{
  "schema_version": "1.0",
  "model": "roketsim_native_3dof_v1",
  "vehicle": { "preset": "verified_demo_vehicle_v1" },
  "motor": { "id": "AEROTECH_F50_4T", "ignition_time_s": 0.0 },
  "launch": {
    "position_world_m": [0.0, 0.0, 0.0],
    "velocity_world_m_s": [0.0, 0.0, 0.0],
    "direction_world_unit": [0.0, 0.0, 1.0]
  },
  "environment": {
    "geopotential_altitude_m": 1200.0,
    "air_mass_velocity_world_m_s": [0.0, 0.0, 0.0]
  },
  "numerics": { "fixed_step_s": 0.01, "maximum_steps": 5000 }
}
